data,interacao,resposta,sentimento
2026-02-15,"Posso gastar R$200 em lazer?","Recomendo priorizar aporte de 10%.","neutro"
2026-02-20,"Completei o aporte de R$500.","Parabéns, você atingiu sua meta!","positivo"
2026-02-25,"Quero investir em Bitcoin.","Não recomendado para perfil moderado.","negativo"
2026-03-01,"Não consegui completar o aporte este mês.","Sugiro ajustar gastos de lazer para priorizar o aporte.","neutro"
2026-03-05,"Quanto falta para minha meta?","Faltam R$150 para completar os R$500.","positivo"
